{
  "schemaVersion": 2,
  "status": "published",
  "channel": "skill-radar",
  "reportDate": "2026-07-06",
  "summary": {
    "zh": "今日重点关注可验证、可迁移的技能工作流。",
    "en": "Today focuses on verifiable and portable skill workflows."
  },
  "conclusion": {
    "zh": "优先采用经过审计的小型技能，不要整包盲装。",
    "en": "Prefer small audited skills over blind full-package installs."
  },
  "stats": {
    "reviewedCount": 15,
    "selectedCount": 1,
    "duplicateCount": 1,
    "rejectedCount": 6,
    "sourceCounts": {
      "github": 7,
      "x": 1
    },
    "xDiscovery": {
      "searched": true,
      "candidateCount": 1,
      "verifiedCount": 1,
      "selectedCount": 0,
      "rejectedCount": 0,
      "deferredCount": 1
    },
    "discoveryCoverage": { "highValidation": 4, "recentGrowth": 4, "emerging": 4, "multiSkillArtifacts": 1 },
    "externalSources": { "ossInsightSearched": true, "radarAiSearched": true, "openSsfChecked": 1, "depsDevChecked": 1 }
  },
  "items": [
    {
      "id": "src_a9bb5331",
      "rank": 1,
      "title": "example/agent-skill",
      "category": "coding workflow",
      "sourceUrl": "https://github.com/example/agent-skill",
      "canonicalUrl": "https://github.com/example/agent-skill",
      "artifactKey": "https://github.com/example/agent-skill",
      "recommendation": "adapt",
      "discovery": {
        "type": "github",
        "url": "https://github.com/example/agent-skill",
        "author": null,
        "publishedAt": null
      },
      "display": {
        "zh": {
          "oneLiner": "把重复的代码审查步骤固化为可验证工作流。",
          "whyNow": "近期增加了测试样例和明确的停止条件。",
          "bestFor": "希望统一代理代码审查流程的团队。",
          "action": "先抽取审查流程并在一个仓库中验证。",
          "primaryCaution": "安装前需要审查附带脚本和权限。",
          "problem": "减少代理跳过测试或安全检查的情况。",
          "usability": "指令可以直接阅读，脚本需要按项目适配。",
          "adaptation": "将工具名替换为Codex现有能力并保留验收门。",
          "trust": "固定commit，逐个审查脚本，不授予不必要权限。"
        },
        "en": {
          "oneLiner": "Turns repeated code-review steps into a verifiable workflow.",
          "whyNow": "Recent updates added fixtures and explicit stop conditions.",
          "bestFor": "Teams standardizing agent-assisted code review.",
          "action": "Extract the review flow and validate it in one repository first.",
          "primaryCaution": "Review bundled scripts and permissions before installation.",
          "problem": "Reduces skipped tests and security checks during agent reviews.",
          "usability": "Instructions are directly readable; scripts need project adaptation.",
          "adaptation": "Map tool names to Codex capabilities and retain acceptance gates.",
          "trust": "Pin a commit, audit scripts individually, and minimize permissions."
        }
      },
      "quality": {
        "dimensions": {
          "valueClarity": 16,
          "nativeUsabilityPortability": 20,
          "implementationQuality": 15,
          "maintenanceHealth": 10,
          "communityValidation": 11,
          "trustSafetyLicense": 10,
          "differentiation": 8
        },
        "evidence": {
          "artifactScope": "individual_skill",
          "artifactPath": null,
          "declaredPlatforms": ["claude-code", "codex"],
          "value": {
            "specificTaskDefined": "met",
            "targetUserDefined": "met",
            "inputsOutputsDefined": "met",
            "workflowImprovementDefined": "met",
            "officialDemonstration": "met",
            "independentOutcomeEvidence": "not_met"
          },
          "usability": {
            "reusableContentPresent": "met",
            "targetPlatformsDocumented": "met",
            "nativeInstallInstructions": "met",
            "nativeUsageExample": "met",
            "dependenciesAndPermissionsDocumented": "met",
            "validationMethodAvailable": "met",
            "coreInstructionsPortable": "met",
            "multiPlatformSupport": "met",
            "adaptationGuideAvailable": "not_applicable"
          },
          "implementation": {
            "documentedStructureMatches": "met",
            "coreFilesSubstantive": "met",
            "triggerOrScopeDefined": "met",
            "executableStepsDefined": "met",
            "constraintsAndFailureModesDefined": "met",
            "testsOrReviewableExamples": "met"
          },
          "maintenance": {
            "repositoryAgeDays": 365,
            "commitCount90d": 12,
            "activeMonths12m": 8,
            "releaseCount12m": 2,
            "contributorCount12m": 4,
            "independentIssueOrPrParticipants90d": 5,
            "hasUnresolvedBlockingIssues": false,
            "archived": false,
            "maintenanceEnded": false
          },
          "community": {
            "stars": 1200,
            "contributors": 6,
            "independentParticipants90d": 5,
            "independentAdoptions": 1,
            "starsGrowth30d": 80,
            "starsGrowth90d": 240,
            "credibleOrganizationBacking": "met",
            "externalVerifiableUsageCase": "met",
            "itemLevelAdoptionEvidence": "met",
            "skillSpecificAttentionEvidence": "met"
          },
          "security": {
            "licensePresent": "met",
            "permissionsDocumented": "met",
            "externalBehaviorDocumented": "met",
            "dangerousActionsRequireConfirmation": "met",
            "installationAuditable": "met",
            "securityPolicyPresent": "met",
            "applicableOpenSsfEvidence": "not_applicable",
            "secretExposureRequested": "not_met",
            "destructiveByDefault": "not_met",
            "unreviewedRemoteExecution": "not_met",
            "unnecessaryElevatedPermissions": "not_met",
            "safetyReviewBypass": "not_met",
            "knownMaliciousBehavior": "not_met"
          },
          "differentiation": {
            "comparisonSources": ["https://github.com/example/comparison"],
            "newProblemCoverage": "met",
            "newAgentFormatOrWorkflow": "met",
            "fewerAdaptationSteps": "not_met",
            "newValidationMechanism": "met",
            "newSecurityOrCollaborationBoundary": "met"
          },
          "evidenceRefs": [
            {
              "field": "usability.reusableContentPresent",
              "fields": [
                "value.specificTaskDefined", "value.targetUserDefined", "value.inputsOutputsDefined", "value.workflowImprovementDefined", "value.officialDemonstration",
                "usability.targetPlatformsDocumented", "usability.nativeInstallInstructions", "usability.nativeUsageExample", "usability.dependenciesAndPermissionsDocumented", "usability.validationMethodAvailable", "usability.coreInstructionsPortable", "usability.multiPlatformSupport",
                "implementation.documentedStructureMatches", "implementation.coreFilesSubstantive", "implementation.triggerOrScopeDefined", "implementation.executableStepsDefined", "implementation.constraintsAndFailureModesDefined", "implementation.testsOrReviewableExamples",
                "maintenance.repositoryAgeDays", "maintenance.commitCount90d", "maintenance.activeMonths12m", "maintenance.releaseCount12m", "maintenance.contributorCount12m", "maintenance.independentIssueOrPrParticipants90d", "maintenance.hasUnresolvedBlockingIssues", "maintenance.archived", "maintenance.maintenanceEnded",
                "community.stars", "community.contributors", "community.independentParticipants90d", "community.independentAdoptions", "community.starsGrowth30d", "community.starsGrowth90d", "community.credibleOrganizationBacking", "community.externalVerifiableUsageCase", "community.itemLevelAdoptionEvidence", "community.skillSpecificAttentionEvidence",
                "security.licensePresent", "security.permissionsDocumented", "security.externalBehaviorDocumented", "security.dangerousActionsRequireConfirmation", "security.installationAuditable", "security.securityPolicyPresent",
                "differentiation.newProblemCoverage", "differentiation.newAgentFormatOrWorkflow", "differentiation.newValidationMechanism", "differentiation.newSecurityOrCollaborationBoundary"
              ],
              "source": "github",
              "location": "skills/example/SKILL.md",
              "observedAt": "2026-07-06T00:00:00.000Z"
            }
          ]
        },
        "baseScore": 90,
        "preferenceAdjustment": 0,
        "finalRankScore": 90,
        "skillLike": true,
        "officialSourceVerified": true,
        "sourceCheckedAt": "2026-07-06T00:00:00.000Z",
        "license": "MIT",
        "history": {
          "seenWithin30Days": false,
          "previousDates": [],
          "materialChange": false,
          "changeEvidence": null
        }
      }
    }
  ],
  "socialDecisions": []
}
